{"schema":"casegraphen.experimental.control_plane.request.v0","request_id":"request:runtime-attachment-1","idempotency_key":"runtime-attachment:1:revision-1","tool":"attach_runtime_report","base_revision_id":"revision:1","caller_declared_audit_context":{"declared_actor_id":"actor:runtime-operator","declared_capability_ids":["capability:runtime-operator-declared"],"declared_operation_scope_id":"scope:case-1","declared_audience":"audit","declared_source_boundary_id":"boundary:mcp-client"},"payload":{"jsonl_record":"{}"}}
